chapter_no,chapter_title,repo_status,represented_sections,tracked_key_theorems,proved_tracked_theorems,missing_core_groups,completion_read,proved_key_theorem_groups,remaining_core_groups,evidence_source,notes
1,The Role of Algorithms,expository,Chapter_01,0,0,0,Guide page only,Project conventions and reader contract,None,CLRSLean/Chapter_01.lean,No formal theorem target.
2,Getting Started,main-proof-complete,2.1;2.2;2.3,6,6,0,Selected chapter sections complete,Insertion sort sortedness and permutation; insertion-sort quadratic comparison bound; merge-sort sortedness/permutation and power-of-two recurrence,Optional strengthening: full RAM semantics; arbitrary-size merge-sort recurrence; exercises,CLRSLean/Chapter_02.lean; CLRSLean/Status.lean,Current main section interfaces are stable.
3,Growth of Functions,partial,3.1;3.2,23,23,1,Core asymptotic wrapper complete; standard-function table incomplete,CLRS asymptotic notation wrappers; polynomial/exponential/log/factorial/harmonic/floor-ceiling growth facts,Complete the remaining CLRS standard-function table,CLRSLean/Chapter_03.lean; CLRSLean/Status.lean,"All tracked theorem names compile, but the chapter is not the whole textbook table yet."
4,Divide-and-Conquer,partial,4.1;4.2;4.3;4.4;4.5;4.6,76,76,3,Large proof core complete; final textbook-facing refinements remain,Maximum subarray correctness; Strassen 2x2 block algebra; substitution templates; recursion-tree expansions; exact-power Master cases; floor/ceiling all-input transfer and discrete Master wrappers; real-log bridge for criticalPowerScale; named case-1 real-log Master wrappers; real-log-log bridge for criticalPowerLogScale; named case-2 real-log-log Master wrappers,Final case-3 comparison scale; recursive Strassen refinement; runtime/RAM layers for maximum subarray,CLRSLean/Chapter_04.lean; CLRSLean/Status.lean; docs/proof-map.md,"Case-1 and case-2 all-input Master theorems now have exact/floor/ceiling wrappers stated directly as Θ(n^(log_b a)) and Θ(n^(log_b a) log n); case-3 comparison remains."
5,Probabilistic Analysis and Randomized Algorithms,selected-section-complete,5.1,6,6,1,Section 5.1 complete; rest of chapter not broadly modeled,Hiring problem finite rank-symmetry probability; harmonic expectation; logarithmic asymptotic expected-hires theorem,Additional randomized-algorithm examples beyond hiring problem are not yet represented,CLRSLean/Chapter_05.lean; CLRSLean/Status.lean,Uses finite rank-symmetry model rather than a general probability framework.
6,Heapsort,main-proof-complete,6.1;6.2;6.3;6.4;6.5,60,60,1,Main Chapter 6 proof stack complete for current array/functional models,Indexed heap predicates; MAX-HEAPIFY repair; BUILD-MAX-HEAP; in-place heapsort invariant and correctness; priority-queue operation state theorems,Full RAM/runtime cost semantics for priority-queue and heap operations,CLRSLean/Chapter_06.lean; CLRSLean/Status.lean,Do not revisit unless there is a specific refinement target.
7,Quicksort,partial,7.1;7.2;7.3,25,25,3,Functional correctness and comparison-count layers proved; probability model incomplete,Partition correctness; scan-state partition loop; quicksort sortedness/permutation; quadratic comparison bound; randomized-quicksort expected-comparison named closed form and harmonic bounds,Index-level mutable-array PARTITION refinement; explicit pivot probability/independence model; sharp n log n tails and lower bounds,CLRSLean/Chapter_07.lean; CLRSLean/Chapter_07/Section_07_2_Performance_Of_Quicksort.lean; CLRSLean/Chapter_07/Section_07_3_Randomized_Quicksort.lean,Status and chapter prose now align with the proved 7.2 and 7.3 layers and the index page lists all represented Ch7 sections.
8,Sorting in Linear Time,main-proof-complete-for-correctness,8.2;8.3;8.4,26,26,2,Correctness layer complete; bucket-sort finite-uniform expected-cost wrapper added; low-level refinements remain,Stable counting sort; count-table refinement; abstract and natural-key radix sort; deterministic bucket-sort correctness; finite-uniform bucket collision probability; bucket-sort quadratic occupancy exact self-case and linear bound; abstract bucket-sort expected-cost exact self-case and linear bound,Imperative reverse-scan output-array implementation of COUNTING-SORT; full bucket-sort expected-time theorem over an explicit independent input distribution and concrete cost model,CLRSLean/Chapter_08.lean; CLRSLean/Chapter_08/Section_08_4_Bucket_Sort.lean; CLRSLean/Status.lean,"Reverse-bucket refinement exists, but not yet single mutable output array; bucket-sort now has the finite-uniform collision/second-moment core plus abstract expected-cost wrapper."
9,Medians and Order Statistics,partial,9.2;9.3,41,41,2,Selection correctness and median-of-medians recurrence layer proved; runtime semantics incomplete,Rank certificates; specification select; quickselect; pivot-parametric SELECT; five-element median certificate; grouped split counts; median-of-medians branch bound; linear recurrence induction,Randomized SELECT expected time; concrete cost semantics for medianOfMediansSelect? connecting executable cost to linear bound,CLRSLean/Chapter_09.lean; CLRSLean/Chapter_09/Section_09_3_Deterministic_Select.lean; CLRSLean/Status.lean,Status and chapter prose now align with the proved recurrence-induction layer.
10,Elementary Data Structures,selected-section-complete,10.1;10.2,6,6,3,Functional stack/queue/list model complete for selected structures,Stack pop/push theorem; queue enqueue/dequeue theorems; linked-list search and delete facts,Pointer-level linked lists; free-list allocation; rooted-tree left-child/right-sibling representation,CLRSLean/Chapter_10.lean; CLRSLean/Status.lean,Current model intentionally avoids imperative memory.
11,Hash Tables,partial,11.1;11.2,20,20,1,Deterministic table behavior proved; finite-uniform expected-cost toolkit added,Direct-address insert/search/delete; deterministic chained hash insert/delete/search facts; finite-uniform singleton bucket probability; uniform-average additivity and nonnegativity; expected chain length equals load factor; unsuccessful-search cost equals one plus load factor and is at least one; finite insert increases total chain length load factor expected chain length and unsuccessful-search cost,Lift finite-uniform expected hashing to a formal random key or random hash-function model with independence assumptions,CLRSLean/Chapter_11.lean; CLRSLean/Chapter_11/Section_11_2_Chained_Hash_Tables.lean; CLRSLean/Status.lean,Deterministic operations are compiler-clean and Chapter 11 now has a stronger finite-uniform expectation toolkit.
12,Binary Search Trees,partial,12.1,26,26,1,Functional BST theorem boundary strengthened; pointer refinement missing,Search; min/max; insertion; complete successor/predecessor some-none specifications; successor/predecessor existence wrappers; functional delete membership ordering; search-after-insert/delete wrappers; successor/predecessor-after-delete wrappers,Parent-pointer procedures; transplant; pointer-level mutation refinement,CLRSLean/Chapter_12.lean; CLRSLean/Chapter_12/Section_12_1_Binary_Search_Trees.lean; CLRSLean/Status.lean,Inductive functional tree model is the current public theorem boundary.
13,Red-Black Trees,partial,13.1,26,26,2,Local invariant layer and unified insertion-fixup local certificates proved; full algorithms missing,Rotation membership; repaint membership; no-red-red; black-height; local red-black shape preservation; four insertion-fixup membership certificates; four insertion-fixup black-height certificates; four insertion-fixup shape certificates; four unified local dispatcher certificates,Compose local certificates into RB-INSERT/RB-INSERT-FIXUP; prove RB-DELETE/RB-DELETE-FIXUP and logarithmic height theorem,CLRSLean/Chapter_13.lean; CLRSLean/Chapter_13/Section_13_1_Red_Black_Trees.lean; CLRSLean/Status.lean,Current work now includes branch-indexed local insertion-fixup certificates without claiming the full red-black algorithms.
14,Augmenting Data Structures,partial,14.1,23,23,2,Order-statistic tree augmentation and local rotation core represented,Size augmentation invariant; size recomputation; key preservation; size/rank-preserving local rotations; cached-root-size preservation; augmented rank-select correctness; recompute-then-rotate selector preservation,Connect rotations to red-black balancing; interval trees and the general augmentation theorem,CLRSLean/Chapter_14.lean; CLRSLean/Chapter_14/Section_14_1_Order_Statistic_Trees.lean; CLRSLean/Status.lean,Functional rotations now preserve inorder keys; mathematical size; cached root size; WellSized; rank-selection semantics; and recompute-then-rotate selector semantics.
15,Dynamic Programming,partial,15.1;15.2;15.4,32,32,2,Rod-cutting matrix-chain and LCS optimality interfaces plus reconstruction certificates represented,Bellman first-cut recurrence bounds; whole-rod candidate bound; every positive-piece plan is bounded; value-attaining plan optimality; matrix-chain parenthesization lower bound; matrix-chain split-table reconstruction cost equality optimality direct inequality and reconstructed-plan equality; LCS certificate optimality; LCS table-recurrence wrappers matching/nonmatching consequences and reconstruction optimality,Bottom-up/memoized rod cutting; executable table/reconstruction algorithms for matrix-chain and LCS; optimal binary search trees,CLRSLean/Chapter_15.lean; CLRSLean/Chapter_15/Section_15_1_Rod_Cutting.lean; CLRSLean/Chapter_15/Section_15_2_Matrix_Chain_Multiplication.lean; CLRSLean/Chapter_15/Section_15_4_Longest_Common_Subsequence.lean; CLRSLean/Status.lean,First pass now covers three dynamic-programming examples at the mathematical optimality-interface level and includes stronger certificate layers for matrix-chain reconstruction and LCS table recurrence.
16,Greedy Algorithms,selected-section-complete,16.1;16.3,21,21,2,Activity selection and Huffman proved; other greedy sections unmodeled,Activity-selection greedy optimality; Huffman V2 frequency-table optimality and minimum-cost wrappers,Other Chapter 16 greedy topics such as matroid/task-scheduling style sections are not represented,CLRSLean/Chapter_16.lean; CLRSLean/Status.lean,Huffman is currently the strongest completed greedy optimality proof.
17,Amortized Analysis,not-started,None,0,0,1,Acceptance standard defined; Lean not represented,No tracked theorem names yet,Generic aggregate/accounting/potential theorems plus MULTIPOP binary-counter and dynamic-table examples,docs/superpowers/specs/2026-06-25-chapters-17-20-acceptance-standards.md; CLRSLean file tree,No Chapter_17 module exists; first-pass target is now fixed for implementation planning.
18,B-Trees,not-started,None,0,0,1,Acceptance standard defined; Lean not represented,No tracked theorem names yet,B-tree invariant height theorem search correctness split-child correctness and insertion correctness,docs/superpowers/specs/2026-06-25-chapters-17-20-acceptance-standards.md; CLRSLean file tree,No Chapter_18 module exists; deletion is required only if the chapter is claimed proved rather than partial.
19,Fibonacci Heaps,not-started,None,0,0,1,Acceptance standard defined; Lean not represented,No tracked theorem names yet,Abstract operation correctness potential-method amortized bounds and logarithmic degree bound,docs/superpowers/specs/2026-06-25-chapters-17-20-acceptance-standards.md; CLRSLean file tree,No Chapter_19 module exists; first-pass target depends on Chapter 17 potential infrastructure.
20,van Emde Boas Trees,not-started,None,0,0,1,Acceptance standard defined; Lean not represented,No tracked theorem names yet,Universe decomposition representation invariant operation correctness and O(log log u) recurrence wrapper,docs/superpowers/specs/2026-06-25-chapters-17-20-acceptance-standards.md; CLRSLean file tree,No Chapter_20 module exists; first-pass target uses a Lean-friendly recursive universe family.
21,Data Structures for Disjoint Sets,not-started,None,0,0,1,Not represented,No tracked theorem names yet,Whole chapter theorem inventory and formalization pending,CLRSLean file tree,Union-find correctness was intentionally deferred for MST work.
22,Elementary Graph Algorithms,not-started,None,0,0,1,Not represented,No tracked theorem names yet,Whole chapter theorem inventory and formalization pending,CLRSLean file tree,No Chapter_22 module exists.
23,Minimum Spanning Trees,partial,23.1;23.2,31,31,3,Mathematical Kruskal/cut-property stack largely built; Prim and automation missing,Cut property; safe edge theorem; exchange certificates; exact-component Kruskal scan; finite-graph spanning-tree and optimality wrappers; cycle-test optimality wrapper,Automatic finite path/cycle exchange extraction; prefix-local sorted-lightness wrapper inside full recursive optimality; Prim theorem interface/proof,CLRSLean/Chapter_23.lean; CLRSLean/Status.lean,Union-find implementation correctness remains intentionally out of scope for now.
24,Single-Source Shortest Paths,not-started,None,0,0,1,Not represented,No tracked theorem names yet,Whole chapter theorem inventory and formalization pending,CLRSLean file tree,No Chapter_24 module exists.
25,All-Pairs Shortest Paths,not-started,None,0,0,1,Not represented,No tracked theorem names yet,Whole chapter theorem inventory and formalization pending,CLRSLean file tree,No Chapter_25 module exists.
26,Maximum Flow,not-started,None,0,0,1,Not represented,No tracked theorem names yet,Whole chapter theorem inventory and formalization pending,CLRSLean file tree,No Chapter_26 module exists.
27,Multithreaded Algorithms,not-started,None,0,0,1,Not represented,No tracked theorem names yet,Whole chapter theorem inventory and formalization pending,CLRSLean file tree,No Chapter_27 module exists.
28,Matrix Operations,not-started,None,0,0,1,Not represented,No tracked theorem names yet,Whole chapter theorem inventory and formalization pending,CLRSLean file tree,No Chapter_28 module exists.
29,Linear Programming,not-started,None,0,0,1,Not represented,No tracked theorem names yet,Whole chapter theorem inventory and formalization pending,CLRSLean file tree,No Chapter_29 module exists.
30,Polynomials and the FFT,not-started,None,0,0,1,Not represented,No tracked theorem names yet,Whole chapter theorem inventory and formalization pending,CLRSLean file tree,No Chapter_30 module exists.
31,Number-Theoretic Algorithms,not-started,None,0,0,1,Not represented,No tracked theorem names yet,Whole chapter theorem inventory and formalization pending,CLRSLean file tree,No Chapter_31 module exists.
32,String Matching,not-started,None,0,0,1,Not represented,No tracked theorem names yet,Whole chapter theorem inventory and formalization pending,CLRSLean file tree,No Chapter_32 module exists.
33,Computational Geometry,not-started,None,0,0,1,Not represented,No tracked theorem names yet,Whole chapter theorem inventory and formalization pending,CLRSLean file tree,No Chapter_33 module exists.
34,NP-Completeness,not-started,None,0,0,1,Not represented,No tracked theorem names yet,Whole chapter theorem inventory and formalization pending,CLRSLean file tree,No Chapter_34 module exists.
35,Approximation Algorithms,not-started,None,0,0,1,Not represented,No tracked theorem names yet,Whole chapter theorem inventory and formalization pending,CLRSLean file tree,No Chapter_35 module exists.
